디저트카페|우무|3|기대를하며 20분 줄 서서 드뎌 샀다.자그마하고 깔끔한 푸딩집, 예쁜언니의 상냥한 설명... 기다려도 기분좋게 만드는 집이다. 3가지맛, 10분 안에 먹어야함... 근데 맛은 .... 너무 상상했나?ㅎ 많이 먹으니 비위가 상하는 느낌? 호불호가 갈리겠네요 찐한 푸딩.. 한번쯤 경험해도 좋을듯, 기다리는시간, 맛, 가격 따지면 안먹겠다는 사람도있어요 ㅎ 6,300원... 마이 비싸게 느껴집니다^^
디저트카페|우무|5|개인적으로 커스타드가 제일 맛있어요!
디저트카페|우무|2|맛있지만 가격 생각하면 이건 인스타 사기극에 가깝다.
디저트카페|우무|5|특색있고 줄도길고 맛은 한번쯤먹어도 괜찮은거같아요 직원분 친절해요ㅎㅎ
디저트카페|우무|3|50이넘은 나는 좀 ㅎ 하지만 젊은이 들이 너무 좋아하는거 같음 맛은 젤리보다 부드럽다
디저트카페|우무|4|한번은 드셔볼만해요~ 직원도 친절한데 가격대비 줄서서 또 가겠다는 아니네요~
디저트카페|우무|4|맛있는 푸딩과 귀엽고 깔끔한 소품들과 악세사리들과 패키지. 우뭇가사리로 이렇게 푸딩을 만들 수 있다는게 신기했는데 맛도 깔끔하니 좋았다. 하지만 가격이 쉽게 추가구매를 하기엔 조금 꺼려짐.... 숟가락 부터 봉투까지 모두 직접 제작한 부분이 눈에 띄임(그래서 비싸질듯)
디저트카페|우무|4|대기 30분 맛은 기본이랑 초코 구매했는데 기본이 진짜 맛있고 약간 두유맛 나네요! 초코는 찐한 빠삐코맛!!
디저트카페|우무|5|푸딩이 살살 녹아요 진짜 맛있어요
디저트카페|우무|4|3.5점이지만 알바인지 사장님인지 모를 분의 친절함에 4점 드리고, 커스터드랑 말차 먹어봤는데 저는 말차가 더 나았어요 조금 더 꾸덕하다고 해야하나? 말차 진해서 맛있었어요 살 때, 말차가 맛이 진해서 커스터드 먹고 말차 먹으랬는데 두개 같이 먹어도 맛 중화되는 거 없이 각각 먹어도 충분히 맛 느낄 수 있어요 굳이 순서대로 먹지 않아도 된다는 말입니다. 커스터드는 그냥 탱글한 푸딩이고 그냥 음 입에서 녹아 없어지는데 그게 막…
디저트카페|우무|5|항상들르는곳..카스테라젤맛나요.개인적으론.. 후루룩마시는 제형이네요..저번에 제주서먹었을땐 좀더 단단함이 있었는대..맛있습니다.
디저트카페|우무|1|가격대비품질은별로에요.푸딩하나포장하는데일회용품이너무많아요.여기사장님은환경오염생각은1도없나보네요.스벅푸딩이훨씬맛나요.겉모습만생각하느푸딩이네요
디저트카페|우무|4|푸딩 얼그레이 - 커스터드 - 녹차 - 초코 순 개별 6300원 30분이내 섭취요망
디저트카페|우무|1|개인취향인것 같아요 푸딩 엄청 좋아하는편인데 전 별로네요 .. 입안에서 사르르 녹는 그런 푸딩인줄 알았는데..
디저트카페|우무|4|제주산 우뭇가사리를 베이스로 만든 푸딩가게입니다. 가게는 심플하고 아기자기한데 직원분은 매우 친절합니다. 부드럽게 찰랑거리는 푸딩은 10분 내에 드시는 것이 가장 좋습니다. 말차, 커스터드, 초콜릿 이렇게 세가지 맛이 있는데 가격이 조금 비싼 편입니다. This is a pudding shop based on Jeju mudfish. The store is simple and cute, but the staff is very…
디저트카페|우무|1|커스터드, 말차, 초코 푸딩 개당 ₩6300. 솔직히 브랜딩과 인스타충 인증용으로 뜬 전형적인 점포 같습니다. 왜 멀리서 찾아왔는지 후회가 느껴졌습니다. 저희 일행 전부 디저트를 좋아해서 해외 곳곳의 유명한 푸딩집을 여럿 가곤 했는데 여긴 생각보다 너무 실망이었습니다. 다들 한 입 먹고 할말이 없어졌을 정도로.... 좋게 말하면 물 같이 가벼운 식감인데 솔직히 밍숭맹숭하게 느껴집니다. 이게 그리 특이한 식감인지도 모르겠습니다.…
디저트카페|우무|3|외부에 주차할 곳은 없는 작은 곳입니다. 외부 디자인은 타일과 나무를 이용해서 깔끔한 느낌이고 작고 아기자기한 느낌이 외부에서 부터 느껴집니다. 이슈가 되면서 줄서서 대기하는 손님들이 많고 역시 인스타그램의 영향으로 사진에 잘나오는 공간이기도 해요!…
디저트카페|우무|4|하얗고 이쁜집.. 좀 좁았지만 테이크아웃만 되는 집이라 상관없었음..…
디저트카페|우무|5|카스타드가 젤 맛있네요 가격이 좀 비싸게 흠이네요 재료비가 좀 들어가서 그런지 모르지만 다시 가기엔 망설여지네요…
디저트카페|우무|5|카스터드, 말차 추천!
디저트카페|우무|3|인스타용 맛집. 사진 찍기 좋은 귀여운 캐릭터로 가는듯. 푸딩자체는 어디서든 흔하게 맛볼 수 있는 맛이나 가격이 엄청나다. 굿즈도 역시 ㅎㄷㄷ함
디저트카페|우무|5|푸딩이 엄청 맜있었어요!저는 네가지맛 다 시켰는데 개인적으로는 초코푸딩과 커스터드푸딩이 맛있었어요! 그리고 푸딩이라서 너무 잘녹아요ㅠㅜ 그래서10분안에 먹어야 하는데 직원한테 아이스펙…
디저트카페|우무|3|제법 기다렸다 먹었습니다 줄이 길더군요~ 가격대비 양은 정말 작았어요ㅠ 푸딩이라는데 푸딩의 탱글함은 없도 정말 흐물거리더라구요. 맛도 특별하진 않아서 다시 제주를 가더라도 또 찾진 않을거 같네요
디저트카페|우무|3|푸딩하나에 줄서있는다고 얼어죽는줄 마케팅은 알겠는데요  밀려오는 짜증은 어쩔은 없어요
디저트카페|우무|5|커스터드 말차 초콜렛 푸딩 세종류있었고 개당 6300원 30분정도 줄서서 받아갔고 점원분 정말 친절하셨다. 1시간내에 먹어야해서 근처 바닷가에서 후다닥 먹어버림 커스터드는 되게 느물느물한 식감이었고 말차도 비슷했다 그나마 초콜렛 식감이 우리가 알던 푸딩과 가장 비슷한 식감이었다. 아이스크림에 가까운…
디저트카페|우무|4|2호점1호점 둘다다녀옴 해수욕장 옆인 1호점이 사서 가서 (테이크아웃전문)사진 찍기는 좋으나 푸딩은 진짜 차가울 때가 맛있기 때문에 개인적으로는 조금더 차갑게보관되는(내점손님 적은이점) 2호점 선호 얼그레이맛이나왔으나 개인적로비추 카스타 말차 초코는 진짜입에녹고 한번먹을만한곳~^^
디저트카페|우무|5|정말 아기자기 귀여운 가게임 초코맛이랑 커스타드맛 먹었는데 둘다 식감이 일반 푸딩보다는 묽음! 우뭇가사리로 만들어서 그런지 젤라틴의 부담스러운 맛이 아님. 초코맛은 커스타드보다 조금 더되직함. 엄청 달지도 않고 씁슬한 카카오맛이 아주 매력적임.  단점은 사고나서 바로 먹어야하는점ㅠ 그래도 푸딩 퀄리티는 정말 좋음…
디저트카페|우무|4|우뭇가사리로 만든 푸딩들인데 맛있었어요. 매장에 한팀만 들어갈 수 있어서 줄이 길어요..
디저트카페|우무|4|얼그레이 빼고 나머지 다 맛있어요!
디저트카페|우무|5|귀여운 캐릭터가 반겨줍니다. 푸딩 맛도 있고 직원분께서 정말 친절하게 대해 주셨습니다. 근처 포인트도 추천해주셔서 그곳에 가서 먹었는데 맛있었습니다.
디저트카페|우무|3|예상보다 맛은 있으나 달아요 가격대가 무지 있고,, 푸딩 좋아하시는 분들은 좋아하실 듯 그치만 기다리는 시간이 좀,, 커스타드만 먹어봐서 다른 맛은 모르겠네요
디저트카페|우무|4|밖에서 기다리는게 조금 덥지만 오래안걸리네요. 사장님이 친절하게 응대해주세요. 기달려주셔서 감사하다고 친절하게 관광잘 하셨냐고 물어봐주시는데 더웠던 불쾌함이 싹 가시네요 :) 맛은 커스타드 마차 초코 3가지인데 커스타드가 제일 맛있고 초코는 싸구려 초콜릿이 아닌 다크 초콜릿맛이 납니다. 맛이 인상깊지는 않지만 방부제가 들어가지 않은 수제 푸딩이라 별 4개 드려요.
디저트카페|우무|3|웨이팅이 너무 길어요. 맛은 있습니다 한번 쯤은 먹어 볼 만 해요. 가격이 좀 비싼편. 주인 두분의 서비스는 좋아요. 더운데 길가에서 거리두기 없이 줄 서있는 건 좀 안좋아 보여요.
디저트카페|우무|2|친절하고 가게도 이쁘고 캐릭터도 귀여워서 사진 찍기 좋았어요. 6900원으로 가격이 너무 사악해요. 커스터드, 말차 먹었는데 커스터드 맛있고, 말차는 호불호 갈릴 것 같아요. 한번 사먹은 걸로 만족해여~ 15분? 쯤 줄 서서 기다렸어요.
디저트카페|우무|5|지나갈때마다 항상 줄이 있는 가게이다 한팀씩 주문을 받으며 친절하게 맞아주신다 커스터드 푸딩이 아주 맛있다 조금 기다려 사 먹을 가치가 있다
디저트카페|우무|4|이런 곳에 푸딩가게가 있어? 라고 생각할 정도로 작은 동네에 위치. 가게는 앙증맞다. 푸딩은 좋아하는 편은 아닌데, 먹어보니 몹시 부드럽다.
디저트카페|우무|3|비싸다 너무 ㄷ ㄷ 초코 맛은 괜찮음
디저트카페|우무|3|초코 커스터드 녹차 세가지 맛을 구입했습니다. 가격은 조금 사악하였으나 귀여워서 괜찮았어요.  맛은 우리가 일반적으로 먹는 푸딩과 비슷하나 식감이 좀 달랐어요. 여기서 호불호가 굉장히 갈릴듯 합니다. 커스티드 - 녹차 - 초코 순으로 단단했습니다. 전 개인적으로 불호.. 많이 먹으면 굉장히 질립니다. 맛별로 하나씩 사서 두분이서 나눠드세오..
디저트카페|우무|2|푸딩의 크기에 비해 비싸서 당황했지만 아기자기 귀여워서 사진찍긴 좋았어요 한번은 가볼만 하지만 두번은 안가볼 집. (얼그레이는 찻잎 맛이 조금 진하게 나고 말랑한 푸딩을 상상했는데 물 되기 직전의 으깨진 푸딩 식감이라 실망 ㅠㅠ , 초코는 맛이 진해요)
디저트카페|우무|4|맛보단 감성.
디저트카페|우무|3|푸딩 맛있음 점원은 은 오늘 뭔일 있는지 무서웠음 ㅋㅋ
디저트카페|우무|5|존맛 입에 들어갈땐 탱글 하고 혀 만나는 순간 액체 됨
디저트카페|우무|4|여자친구가 엄청 좋아하네요 푸딩좋아하는 사람은 맛있다는데 전 흐뮬흐뮬 ㅎ…
디저트카페|우무|5|귀여운 이미지에 너무 유명한 탓에 저는 모양만 이쁜, 특이하기만 한 푸딩이란 이미지가 제게 강했어요 커스터드랑 녹차 주문했는데 와 .. 진짜 맛있어요 처음에는 뭐지? 했는데 계속 먹으니 너무 맛있어서…
디저트카페|우무|4|기다림이 아쉽지 않은 친절함. 생각보다 높은 퀄리티
디저트카페|우무|2|근처 해변에서 사진찍고 있는데 이 봉투 들고 사진찍는 커플들이 몇몇 보이길래 우리도 인싸가 돼보자며 찾아서 가본 푸딩집. 사장님께서 제주도와 잘 맞는 우뭇가사리라는 유니크한 식품아이디어와 10, 20대 취향 저격하는 감성마케팅을 잘 하시는 것 같다. 맛이 없진 않지만 가격을 생각하면 다신 안 사먹을 것 같은 비싼 가격에 그에 비해 밍밍한 푸딩을 먹어볼 수 있다. 이쁘게 사진 찍고 싶었는데 제주도는 바람이 너무 쎄서 도저히 감성감성 사진 찍기가 힘들더라.
디저트카페|우무|4|워낙 유명한 곳이라 기대하는 마음으로 갓습니다. 테이크아웃 전용 가게라 아담햇엇고 도로가에 잇어서 찾기는쉬웠지만 이런곳에 잇네? 라는 느낌을 받을만큼 조금 쌩뚱맞은 장소에 잇엇어요. 깔끔한 인테리어에 캐릭터 굿즈들이 잇구요, 귀엽지만 가격대가 좀 잇는 편이에요. 포장도 새심하게 잘 해주시고 무엇보다 건강한 맛이라 만족합니다. 또 가야겟다는 생각은 안 들지만 제주에만 잇어서 한번 쯤은 들르기 좋아요
디저트카페|우무|5|인공적인맛 하나 없이 담백했어용 :)
디저트카페|우무|4|줄서있는곳이 우무입니다. 직원분들은 엄청친절하시네요. 가격은 약간 비싼거 같아요. 맛은 그냥 그런 푸딩맛. 모양,포장은 이뻐서 인스타용으론 좋을듯 하네요
디저트카페|우무|5|적당한 달콤함을 좋아하면 카스터드!! 일인당 두개 드세요 세개드세요 네개드세요
디저트카페|우무|2|커스터드맛이랑 초코맛먹었는데 제스타일은 아니었어요 ㅎㅎㅎ,,, 입맛차이 ㅎㅎ 같이먹은사람들은 맛잇다네요! 주차는 옆에 공용 무료 주차장에 하시고 기다려서 사면 되여~
디저트카페|우무|5|줄을 설 때 까지만해도 왜 이렇게까지 기다려야하나 싶었는데 한참 기다리고 받아서 먹어보니 너무 맛있어서... 1시간의 기다림 = 5분의 행복 인 분은 한번 드셔보세요! 갠적으로 말차맛이 찐하고 쌉쌀하니 으른의 말차맛이라 좋더라구요ㅎㅎ
디저트카페|우무|5|사장님이신지 직원분이신지 너무 귀엽고 친절하세요 20분 넘게 기다리다 구입했는데... 너무너무 맛있어요 많이 달지도않고~~ 다시 꼭 가고싶은 곳이에요
디저트카페|우무|3|제주 우뭇가사리를 사용한 푸딩을 파는 푸딩가게 귀여운 캐릭 덕분에 항상 사람이 붐빈다 푸딩은 진짜 물떠먹는듯한 극한의 부드러움을 자랑하며 물처럼 마실수도있다 맛은 무난한 커스타드크림이 단맛이 과하지않고 좋다
디저트카페|우무|4|라떼인가 할정도로 엄청 부드러웠고, 맛은 생각 보다 진하고 맛있었다. 가게는 요즘 트렌드에 맞게 세련된 느낌이였고, 먹는 공간 없이 판매만 한다. 커스터드푸딩이 이 집의 대표 메뉴로 보이고 개인적으로 말차나 초코보다는 커스터드 푸딩이 맛이 제일 좋다. 가격은 높은편이고, 위치도 애매하지만 의외로 버스타고도 많이들  올 정도로 Hot한 곳이니 대기 10~20분(월요일  기준)정도는 각오해야할듯.
디저트카페|우무|5|우무 여기 추천받고왔는데 얼그레이가 의외로 ㄱ존맛탱 초코는 너무 달고 푸딩보단 뭔가 요거트같은 느낌 나머진 다음에 먹을 예정~
디저트카페|우무|4|해녀들이 채취한 우뭇가사리로 만든 푸딩. 보관이 어려워 구매 후 바로 먹어야 하고 육지로 가져갈수가 없어서 더욱 인기가 많은듯. 역시 인터넷의 힘이 대단함을 다시 한번 느낌.
디저트카페|우무|5|사장님도 친절하시고 푸딩도 맛있어요~
디저트카페|우무|5|공간이 협소해서 한팀씩 구매할수있어요 전 요즘같은 때에 차라리 이게 더 좋은것같아요…
디저트카페|우무|4|포장이 귀엽고 맛도있었어요
디저트카페|우무|5|푸딩 좋아해서 눈에 보이면 사먹는데 우무푸딩 너무 맛있어요. 먹으면 스르륵 녹아요~ 다 맛있는데  커스타드가 제일 맛있고  아!녹차  좋아하신다면 녹차푸딩 맛있어요. 3일 제주 머무는데 2일 갔네요 :)
디저트카페|우무|4|아래 리뷰처럼 사진용으로 구매하는 사람도 많겠지만 저는 이번이 두번째 방문이였는데.. 정말 맛있어서 재방문했습니다! 말차는 잘모르겠고 커스타드 맛 진짜진짜 엄청 맛있어요! 초코는 초코맛이 엄청 찐해서 카카오99%처럼 오히려 약간 쓰게 느껴져요! 그래도 초코덕후들은 엄청 좋아할 맛! 커스타드맛은 무조건 드세요! 판매하시는분도 어찌나 친절하던지 줄서서 샀지만 기분 좋게 사서 먹었어요! 바로 먹으라고 권유하시지만 이동거리가 있다고하면 아이스팩 포장도 해주시고 냉장보관이 바로 가능할 경우엔 당일안에만 먹으면 된다고 안내받았습니다~
디저트카페|우무|4|인스타 유명 가게 '인스타' 모든 것을 설명함…
디저트카페|우무|4|제주산 우뭇가사리로 만들었다는 의미는 좋다. 맛은있으나 다만 가격이 비쌈. 보통 푸딩의 쫀득함은 기대하지않는것이 좋다.
디저트카페|우무|3|커스터드 푸딩 말고는 맛이 좀 어려워요. 너무 친절하고 포장까지 감성 넘칩니다. 맛보다 기분으로 방문하고 싶은 곳.
디저트카페|우무|3|우뭇가사리로 만든 푸딩이라 그리 기대는 안했지만 예상외로 부드럽고 먹을만 했음  코로나 때문인지 원래 그런건진 모르겠으나 가게에는 무조건 한팀씩만 들어갈수 있는데 만약 원래부터 대단하다고 생각함 줄선 사람들 심리로 따라서…
디저트카페|우무|5|사장님 너무 친절하시고 카페도 아기자기해요 테이크아웃밖에 안되지만 푸딩 너무 귀엽고 맛있어서 재방문의사 100%입니다.
디저트카페|우무|3|진짜 금방 녹네요. 빨리드세요. 10분 안짝입니다.
디저트카페|우무|2|제주 우뭇가사리로 만들며 첨가물을 넣지 않아 독특한 질감과 맛이 난다. 방문했을 때는 커스타드 푸딩만 남아있어 아쉬웠음. 우유맛이 많이 나고 텁텁하기 때문에 시판푸딩이 익숙하다면 조금 어색할 수도
디저트카페|우무|1|굿즈만 팔고 푸딩을 공짜로 줘도 될거같은 퀄러티의 푸딩 세가지 맛 모두 구입했는데…
디저트카페|우무|4|기대를 안해서 그런가 식감이 새롭고 맛있었음! 다만 초코가 정말 별로였다.. 가루초코맛...
디저트카페|우무|2|부드러운 텍스처 뿐이다.
디저트카페|우무|5|기대안하고 갔는데... 완전 부드러운 푸딩이에요. 커스터드 맛이 가장 좋았어요. 초코는 초딩딸이 먹어도 넘 달다고 할정도...대기줄길어도 금새빠져요. 사장님 넘 친절함. 커스터드만 먹으러 또가고 싶네요
디저트카페|우무|4|푸딩이 조금 비싸다, 앉아서 먹을 수 없다.ㅡ주차공간도 없다♤단, 디자인은 아기자기하다, 단순해서 좋다♧차에서 맛보면서 이동했다, 앉아서 먹을 곳을 찾기 쉽지않다ㅡ여유를 느껴보자
디저트카페|우무|5|매장이 좁아서 1팀씹 금방금방 사서 나와야하는 상황이네요
디저트카페|우무|3|직원분이 상냥하고 친절하셔서 인상에 남아요.  일본의 탱글한 푸딩의 식감은 아니에요.…
디저트카페|우무|4|테이크아웃만 가능. 근데 15분 안에 꼭  먹어야한다는게 함정...ㄷㄷㄷㄷ ㅡㅡ?? 15분이 지나면 절대안된다고 신신당부함... 사서 나와서 길에서 먹어야되는거ㅋㅋㅌㅋㅋㅋ 맛있긴 해요!!
디저트카페|우무|4|작고 귀여운 우무!!!😍 제가 갔을때 푸딩은 3가지였어요 오리지날,말차,초코였던거같아요…
디저트카페|우무|4|한번에 한팀씩만 입장 가능해서  웨이팅 후 들어감 가격은 좀 있는 편이지만, 괜찮음. 푸딩집에 한국 에 별로 없어 아쉬움
디저트카페|우무|1|줄 너무 오래서고 맛은 별로
디저트카페|우무|1|가격대비 완전 비추입니다. 푸딩 7천원? 마트에서 파는 푸딩이 더 맛나유
디저트카페|우무|5|혼자가서 하나만샀는데...두개살껄...
디저트카페|우무|5|너무너무 맛있는데 10분 내로 먹어야한다는게 진짜진짜 아쉬워요 싸오고 싶어요
디저트카페|우무|5|기다려서 사먹었어요 커스타드맛있어요 빠른시간내먹어야는게 관건인듯해요…
디저트카페|우무|3|20분정도 기다려서 샀어요 맛은 그냥 그래요
디저트카페|우무|5|줄이 길다고 가시면 후회합니다. 줄이 금방줄어들어용 맛있습니다 커스터드 맛있습니다
디저트카페|우무|4|맛잇음 우유맛? 이랑 말차맛 먹음 우유맛이 최고…
디저트카페|우무|3|인스타 맛집 ㅋㅋ 궁금해서 가봤는데 사장님은 정말 친절하심 손님 한분한분 친절하게 대화도 하시고 좋았음 커스터드푸딩은 맑고 깔끔한 느낌이고 말차푸딩은 녹차맛이 강해서 호불호임 재 방문은 안 할듯
디저트카페|우무|4|커스타드는맛있고요 나머지는 ㅠ 10분안에먹는게좀힘들지만 존맛탱
디저트카페|우무|5|기욤기욤 합니다. 많이 안달고 얼그레이ㆍ초코ㆍ말차ㆍ커스터드 4가지맛 ~…
디저트카페|우무|4|역시 너무 맛있음.꼭 드셔보시길 바랄게요.
디저트카페|우무|2|그냥 젊은 여인들 감성샷, 인스타 사진 찍으러 가는....
디저트카페|우무|5|맛있어용 추천 가격은 좀 비쌈
디저트카페|우무|3|얼그레이맛 진짜 진한데 끝맛이 너무 향긋하다고 해야하나? 호불호 갈릴거 같았아요. 커스터드는 걍 그랬고 말차가 진하니 맛있었는데 가성비 별로,,
디저트카페|우무|5|푸딩인데 달지 않고 맛있어요. 근데 푸딩은 단맛으로 먹는거 아닌가.... 그냥 그렇다구요
디저트카페|우무|4|하나정도 먹어볼만!
디저트카페|우무|3|일단 주차가 어려운집이고 손님에게 배려?가 없어 보이네요. 맛이 좋은집 입니다.
디저트카페|우무|4|방부제가ㅜ들어가지않아 10분이지나면 바로 상해버린다고함 ㅠ 맛은있음
디저트카페|우무|1|줄 엄청 서서 먹었는데 맛없음 .. 가게 내부도 너무 좁아서 볼 것도 없음 왜 인기인지 모르겠음
디저트카페|우무|5|술술넘어가요. 맛있어요. 건강한맛
디저트카페|우무|4|한 15분줄서서 받음 사장님?친절하시고 먹는순서알려주심 커스타드는 맛나지만 조금 아쉬운느낌…
디저트카페|우무|3|음. 요즘 인스타 갬성 느낌. 가격이 비쌈. 줄 서서 먹을 맛인지는 잘 모르겠음.
디저트카페|우무|4|푸딩치고는 가격이 좀 센 편이지만 정말 맛있었어요 :)
디저트카페|우무|4|맛좋은 푸딩입니다. 테이크아웃해서 맛있는 커피와 함께 먹으면 좋아요. 다만 가격은 다소 비싼편
디저트카페|우무|3|푸딩인데 아 ~~!!! 조카들은  인증사진찍고 난리인데 우리 나이 입맛에는 그냥...…
디저트카페|우무|4|가게가 엄청 작기 때문에 웨이팅 꽤 오래 하실 생각으로 가야합니다....!!
디저트카페|우무|1|우뭇가사리가 레어하다는 리뷰도 있는데 우뭇가사리는 싸고 주변에서 접하기 쉬운 흔한 재료입니다... 여기 땀흘리면서 기다렸다가 사먹었는데... 비싸고 맛은..... 하아............ 노코멘트 할게요....
디저트카페|우무|4|커스터드가 젤 맛있습니다. 말차는 취향아니시면 진해서 추천안드리고 초코는 진한 가나나 빠삐꼬 맛입니디 한 20분 웨이팅 했네요
디저트카페|우무|2|줄 설 정도는 아닌듯
디저트카페|우무|4|줄이 너무 길어서 조금 놀랐지만, 커스터드 /말차 푸딩 두가지를 구매했습니다. 당 떨어질 때 먹으면 기가막힙니다. 씁쓸한 맛을 좋아하면 말차푸딩 추천 합니다.
디저트카페|우무|4|우뭇가사리로 만든 푸딩 넘나 맛있네요
디저트카페|우무|1|구입후 10분안에 먹을수 있음 오삼 구입후 서서 먹을수 있으면 오삼 오래 기다릴 자신 있음 오삼…
디저트카페|우무|3|커스터드는 우유맛이 강했고 말차는 딱 말차다웠고 초코는 베이킹에 사용하는 저가 초코 맛. 호기심에 한번쯤 먹어 볼만 하다 꾸준히 찾아가 먹진 않을듯.
디저트카페|우무|5|음식이 매우맛있고 서비스가 친절함
디저트카페|우무|4|가격이 비싸지만 좋은재료입니다! 우뭇가사리로 만들었고 방부제없이만들어서 빨리 먹어야해요!!
디저트카페|우무|5|한번쯤 먹어보면 좋을 맛!!
디저트카페|우무|3|사실 푸딩 안 젛아하는데  도전 주인장 무지 친절하소품예뻐요
디저트카페|우무|4|말차 좋아하는데 말차푸딩 찐하고 맛있었움 식감은 탱글하다기 보단 숟가락으로 푸면 그대로 푸우욱 퍼져요 나름 특이해서 찾아가볼만해요 30분정도 기다렸늠데 후회스럽진 않았음 근데 그이상 기다리면 쪼끔 화날거같음 그리고 이게 6000원이라니 너무 비싸요ㅠ 소품들도 너무너무너무비쌈
디저트카페|우무|3|한 개 6,800원 머스타드 녹차 얼그레이 초코 무방부제 순수 식품 이므로 10분 내 섭취 비쌈...
디저트카페|우무|3|줄서서 먹을 정도는 아닌 곳. 우뭇가사리 푸딩을 처음 경험해 보아서 새로운 느낌이나  찾아가서 먹을 곳은 아닌 느낌
디저트카페|우무|2|지역상품이라 그런지 너무 너무 비싸다 땡볕에 줄도 서고~ㅠㅠ~
디저트카페|우무|5|남자친구가 좋아하네요
디저트카페|하이엔드제주|3|커피 마시러 갔다가 산책로 걷다왔네요. 한담해변 메인은 아니라 에메랄드 바다를 보기는 좀 어려워요. 커피도 소소... 팡도르는 괜찮아요
디저트카페|하이엔드제주|4|바다가 바로 앞에 펼쳐져서 예쁜 카페로 추천드립니다. 현무암 빵 & 현무암 젤라또가 있어 특이하면서 맛있는 빵 / 디저트 찾는다면 추천합니다. 카페앞 / 바닷길 따라 산책로 있어 너무 좋습니다 ~…
