커피전문점|스타벅스 성산일출봉점|5|명불허전 2층에서 커피한잔하시면 성산일출봉이 뜨악 .. 커피맛도 좋고 편안하게 쉬다 갑니다. 가볼만하고 좋아요.
커피전문점|스타벅스 성산일출봉점|5|음료도 좋고 직원들도 친절
커피전문점|스타벅스 성산일출봉점|4|천혜향 블랙티 블렌디드가 맛있어요ㅎㅎ
커피전문점|스타벅스 성산일출봉점|5|성산일출봉 아래 카페 밀집한곳에 위치해있어요. 스벅 바로옆에 메가인지 커피숍도있던데.. 암튼 스벅은 주차장있습니다. 일층 매장엔 긴바형 좌석있고 텀블러나 DM들 전시되있고 시이렌오더 가능하고 음료기다리며 제주에서만 살수있는 DM구경하는 재미있네요. 그치만 제가 좋아하는 허니블랙자몽티에 건더기는 아주 초큼 들어가서 실망했네요ㅠ 서울이 더 많이줘요 건더기ㅠ 허니는 많이넣으셨는지 첫모금에 너무 달아서 사레걸리고 ㅋ 지극히 개인적인…
커피전문점|스타벅스 성산일출봉점|5|쑥차라떼♡
커피전문점|스타벅스 성산일출봉점|5|제주만의 특별 디져트 굿굿 샌드위치도 맛있었음
커피전문점|스타벅스 성산일출봉점|4|제주에서만 먹을 수 있는 음료와 디저트를 먹어봤는데 흑임자, 쑥 프라푸치노, 감귤 에이드 모두 맛있고 비쥬얼도 좋았다. 근데 흑임자, 쑥 프라푸치노를 먹으면 너무 달아서 감귤 에이드가 엄청 맛없게 느껴지므로 에이드를 먼저 먹던가 따로 먹어야 한다. 디저트는 크로와상, 스콘은 그냥 평범했고 생각보다 감귤 머핀이 향도 좋고 맛있었다.
커피전문점|스타벅스 성산일출봉점|4|성산일출봉 정면을 바라보고 주차장 왼쪽에 위치한 스타벅스 입니다. 리저브 매장 아니고 1,2층 까지 있지만 내부 좌석이 부족하니 쿠폰있으시면 이용하세요. 그리고 일출봉 올라가시면 커피 파는곳이 없으니 미리 한잔하고 가시던가 아니면 구경다하고 쉬도록 하세요. 일출봉엔 음식물 가지고 가는거 아니랍니다. 그러나 올라가는 중간에 먹거리 팔고 있어서 아이러니 합니다. 한여름에 창가쪽은 아주 핫할테니 참고하셔요 ^^
커피전문점|스타벅스 성산일출봉점|5|점포가 조금 작은 편이라서 아쉽지만 그거 외에는 괜찮아요
커피전문점|스타벅스 성산일출봉점|4|관광지 앞에 위치한만큼 손님이 굉장히 많고 주문하고 음료가 나오기까지 시간이 꽤 오래 걸리는 곳이다. 하지만 직원들이 굉장히 친절하게 응대해주어서 오래걸려도 기분이 좋음. 제주도에서만 맛볼 수 있는 음료와 케이크 종류가 다양하고 제주에만 판매하는 MD상품들도 많이 있다. 2층이 있어 자리는 꽤 여유로웠음.
커피전문점|스타벅스 성산일출봉점|5|외관은 다소 낡았으나 제주특선음료때문에 들렀어요 성산일출봉 등반(?)후 시원하게 제주청귤에이드 한잔 먹으니 시원하고 좋습니다 에이드 안에 젤리같은게 조금 들어있어요!!
커피전문점|스타벅스 성산일출봉점|4|제주도, 성산일출봉만의 특별한 아이템들이 많아 스타벅스 마니아들의 구매욕구를 자극함
커피전문점|스타벅스 성산일출봉점|5|성산일출봉갈때마다 여기 들러요. 뷰가 좋은편이에요.  성산일출봉이 보이거든요. 근데 스벅은 역시 케익이 맛이없어... 글구 이거 음료기억안나는데 유자 블랙티엿나먼가 근데 끝맛이 좀 써요
커피전문점|스타벅스 성산일출봉점|5|풍경 좋고 제주한정 메뉴도 맛보고
커피전문점|스타벅스 성산일출봉점|5|고급스러운 곳은 아니지만 아침일찍 일출봉에서 내려오며 커피가 생각날쯤 눈에 딱 들어옵니다.
커피전문점|스타벅스 성산일출봉점|4|제주 대표 스벅 제주에서만 파는 음료와 케잌을 먹을 수 있다. 맛은 호불호가 있을 듯 하지만
커피전문점|스타벅스 성산일출봉점|3|주차장은 일출봉 주차장!!! 거리두기로 좌석이 많이 줄어들었습니다. To go 추천이용
커피전문점|스타벅스 성산일출봉점|2|맛드럽게없음  제주천혜향 어쩌구
커피전문점|스타벅스 성산일출봉점|3|평범한 스타벅스
커피전문점|스타벅스 성산일출봉점|4|별한개 차감! 천혜향 머시기가 맹탕이에요 ㅋㅋ
커피전문점|스타벅스 성산일출봉점|5|제주에만 있는 메뉴 마시는게 행복이네유 친절하시고 맛있게 먹었어용
커피전문점|스타벅스 성산일출봉점|5|직원분들이 친절하시고 음료도 맛있어요~~ 에어컨 청소만 좀 해주셨음 좋겠어요~
커피전문점|스타벅스 성산일출봉점|5|직원분들이 매우 친절합니다.
커피전문점|스타벅스 성산일출봉점|4|이층에서 성산일출 뷰가 멋지네요 다만 유리창이 좀 얼룩이 심해요
커피전문점|스타벅스 성산일출봉점|2|뷰는 좀 괜찮은데 뷰볼수 있는 창문이나 깨끗하게 해놨으면...
커피전문점|스타벅스 성산일출봉점|3|익숙한 맛, 특별한 풍경, 스벅 이 간사한 상업성에 혀를 내두른다
커피전문점|스타벅스 성산일출봉점|5|우리나라 스벅매출1위라네..뭐래나.ㅎ
커피전문점|스타벅스 성산일출봉점|5|정말.. 너무 좋네요ㅠㅠ
커피전문점|스타벅스 성산일출봉점|3|스벅맛은 다 똑같죠... 6시까지니 참고하시길! 성산에 스벅 2곳입니다. 성산dt점이랑 성산일출봉점 달라요~~~~
커피전문점|스타벅스 성산일출봉점|4|뷰가 너무 좋으네요~제주특산 음로도 맛있고 휴가로 왔는데 제대로 쉬는것같아요~^^
커피전문점|스타벅스 성산일출봉점|4|성산일출봉에서 거센 바닷 바람 맞고 내려와서 마시는 커피한잔과 카스테라.. 맛의 조화가 환상적이군요! 그리고 해질 무렵 스벅에서 바라본 일출봉의 모습과 하나 둘씩 켜지는 불빛..
커피전문점|스타벅스 성산일출봉점|3|뷰 좋은 스벅. 제주도 한정메뉴인듯한 까망라떼 처음 먹어봤는데 두유맛이다.
커피전문점|스타벅스 성산일출봉점|3|어딜가나 스타벅스가 있죠. 프랑크푸르트를 가던 뉴욕을 가던 없는 곳이 없습니다. 성산일출봉 코앞에 스타벅스가 있다니.. ^^ 솔직히 잘 어울리는 것 같진 않네요.
커피전문점|스타벅스 성산일출봉점|5|좋습니다. 경치는 볼거없지만 아담합니다.
커피전문점|스타벅스 성산일출봉점|3|사람이 너무많지만  제주에서만 느낄수있는 일출봉뷰! 그리고 음료!
커피전문점|스타벅스 성산일출봉점|5|직원들 친절하고 제조 음료가 타매장보다 더 맛있는거 같다.
커피전문점|스타벅스 성산일출봉점|4|주변이 이쁘네요
커피전문점|스타벅스 성산일출봉점|5|성산일출봉이 눈앞에서 잘보여요. 일출봉 다녀와서 시원한 커피한잔하기 좋아요
커피전문점|스타벅스 성산일출봉점|4|2층 건물이며 항상 사람이 많습니다.
커피전문점|스타벅스 성산일출봉점|4|매장은 그리 크지 않고 2층이 있는데 창가에서 성산일출봉이 바로 보여요. 창이 좀 지저분한게 흠..그곳에 앉아 여유있게 제주에만 있는 까망크림프라푸치노 마셨는데 떡이 씹히고 맛있었어요.
커피전문점|스타벅스 성산일출봉점|4|성산일출봉 바로 앞에 위치한 스타벅스입니다. 건물 옆쪽으로 2-3대 가량 주차가능하며, 앞쪽이 성산일출봉 주차장이라 주차공간 자체는 넓다고 할 수 있습니다. 다만 성산일출봉이 인기 관광지인 만큼 항상 관광객들로 붐비기 때문에 주차하기 쉽지 않습니다. 제주도 한정 메뉴인 쑥떡라떼나 흑임자 등의 음료를 맛 볼 수 있고, 마찬가지로 제주한정 스타벅스md 상품들을  구매가능합니다. 2-3층 가량의 건물로 1층 주문대 옆쪽에 화장실이…
커피전문점|스타벅스 성산일출봉점|4|2층이 좋은데 전신주 전기줄이 뷰를 망치네요
커피전문점|스타벅스 성산일출봉점|4|사람 많은 거에 비해 깨끗하게 관리가 잘 되어있고 음료 맛도 괜찮은 편입니다
커피전문점|스타벅스 성산일출봉점|4|성산일출봉 입구에 위치 경치가 좋아요.. 비오는 제주 성산일출봉에서 따뜻한 커피한잔...여유
커피전문점|스타벅스 성산일출봉점|5|굿 사이렌오더 주문가능.
커피전문점|스타벅스 성산일출봉점|5|제주도 만의 메뉴를 먹을 수 있어서 좋았어요
커피전문점|스타벅스 성산일출봉점|4|제주도 스벅의 한정메뉴를 즐겨봤는데 특별한 경험이었어요~
커피전문점|스타벅스 성산일출봉점|5|다른 지점에 비해 커피맛이 좋아요. 크루 친절도도 높고요.
커피전문점|스타벅스 성산일출봉점|5|사람이 많아서 그렇지만 뷰는 최고입니다. 나름 코로나에도 신경쓰는 부분도 느껴지네요
커피전문점|스타벅스 성산일출봉점|4|성산일출봉을 바라보고 적당히 시원하고 달달한 제주만의 특색있는 스타벅스 제품들을 만나는 장소. 고정적인 매장 방문객들 보단 테이크아웃으로 성산일출봉 주변을 거닐며 마시는 관광객이 다수 였다. 관장지의 특성 상 오픈이 타 매장보다 늦고, 마감이 타 매장보다 상당히 빠르다. 그도 그럴것이 스타벅스 음료를 마시기 위해 굳이 성산일출봉점 까지 오는 것 보다는 오는 길에도 여러 스타벅스를 만날 수 있었다. 딱 관광지에 특성화 된 다소 정돈 된 매장의 느낌을 받기에 충분했다.
커피전문점|스타벅스 성산일출봉점|3|작아서 좋은 자리는 빨리 차는데 한번쯤 가기 좋은데 근처에 드라이브뜨루있어서 거기도 렌트카 있으시면 나을 수도 있어요. 성산일출봉 올라갔다 좀 쉬기도 창밖 풍경 바라보기는 좋아요.
커피전문점|스타벅스 성산일출봉점|1|사람들은 바글바글하고 위생 관리가 제대로 되고 있는지도 모르겠고... 암튼 최악이네요
커피전문점|스타벅스 성산일출봉점|4|성산일출봉 갔다가 제주에서만 마실 수 있는 음료를 마시니 개좋음
커피전문점|스타벅스 성산일출봉점|1|복잡 하고 어려웠다.
커피전문점|스타벅스 성산일출봉점|5|일하시는분들의 서비스와 목소리가 좋았다. 손님이 많음에도 서비스마인드👍
커피전문점|스타벅스 성산일출봉점|3|비쌈, 좁음
커피전문점|스타벅스 성산일출봉점|4|제주에서만 먹을 수 있는 메뉴있어 좋아요
커피전문점|스타벅스 성산일출봉점|4|직윈들 친철도는 최고요
커피전문점|스타벅스 성산일출봉점|5|구석 자리를 노리면 성산일출봉을 바라보며 여유를 즐길 수 있음. 하지만 제주 특선 꿀땅콩라떼는... 맛이 별로.
커피전문점|스타벅스 성산일출봉점|5|뷰가 좋아요
커피전문점|스타벅스 성산일출봉점|4|제주지역에서만 맛볼수 있는 푸드와 음료 그리고 상품
커피전문점|스타벅스 성산일출봉점|4|성산일출봉 등산이후 마시는 시원한 음료가 좋습니다.
커피전문점|스타벅스 성산일출봉점|5|2층에는 이렇게 성산일출봉을 배경으로 앉아서 마실 수 있는 공간이 있어요. 제주 까망 크림 프라푸치노 & 제주 쑥떡 크림 프라푸치노 존맛!
커피전문점|스타벅스 성산일출봉점|5|혼자 의자에 앉아 쑥쑥프라푸치노와 당근 케익을 먹는 기분이란.. 너무나 좋았습니다
커피전문점|스타벅스 성산일출봉점|4|서비스, 성산일출봉이 바로 보이는 뷰, 성산일출봉 주차장과 가까운 거리 등 거의 모든 게 편했지만 평일임에도 조금 북적였고 3층정도 있지만 한층이 좁은 느낌이었음. 하지만 이거 외에 잠깐 들리는 목적으로는 괜찮은듯!
커피전문점|스타벅스 성산일출봉점|3|걍 그냥그래요 사람이많네요
커피전문점|스타벅스 성산일출봉점|5|방역수칙 잘지키고 깔끔
커피전문점|스타벅스 성산일출봉점|5|일출봉을 바라보며 시원하게 음료 한 잔~ 여행중 잠시 쉼표를 찍어갈 수 있는 좋은 장소 입니다.
커피전문점|스타벅스 성산일출봉점|4|성산일출봉이 바로 눈 앞에 있습니다. 이곳에 앉아 있으면 올라 간것과 마찬가지입니다.
커피전문점|스타벅스 성산일출봉점|5|제주도 원산지 재료로 된 음식을 맛볼 수 있는 카페
커피전문점|스타벅스 성산일출봉점|5|흑임자 개꿀맛 제주도 스벅에서만 바라열
커피전문점|스타벅스 성산일출봉점|5|매번가지만 성산일충봉 너무좋아요
커피전문점|스타벅스 성산일출봉점|5|스벅 가격이야 비슷한것이고 확실히 성산일출봉이 보이는 뷰라는점을 높게사고싶음 고층빌딩 사이의 스벅도 별4개라는것을 감안하면 5개가 합리적임
커피전문점|스타벅스 성산일출봉점|4|2층에서 성산일출봉을 보며 커피한잔의 여유
커피전문점|스타벅스 성산일출봉점|4|스벅은 어딜가든 항상 평타는 칩니다. 제주도에서만 시킬 수 있는 메뉴가 있습니다
커피전문점|스타벅스 성산일출봉점|2|좁아요..기계같은 직원도 친절하지않습니다
커피전문점|스타벅스 성산일출봉점|5|스타벅스를안가봐서 여긴만파는지모르겠는데 한라봉 뭐시긴가 졸맛남
커피전문점|스타벅스 성산일출봉점|5|아침도 맛집가서 든든히 먹으려다가, 맛나식당 문닫아서 스벅에서 아침 먹었어요. 성산일출봉 바라보면서 먹으니까 여기가 맛집이네요ㅎㅎ 간단히 먹고 점심을 맛있게 먹으려구요~!
커피전문점|스타벅스 성산일출봉점|4|성산일출봉 매표소입구에 위치 2층에서 창밖으로 일출봉이 보임
커피전문점|스타벅스 성산일출봉점|5|성산일출봉점이라는것만으로도 갈만해요! 제주도에서만 먹을수있는 음료도 꼭 먹어봐요~!
커피전문점|스타벅스 성산일출봉점|3|사람이 너무 많아요. 혼잡하고 제주에만 있다는 케익 먹었는데 맛 별로네요.
커피전문점|스타벅스 성산일출봉점|3|시그니쳐메뉴 그럭저럭 괜찮습니다
커피전문점|스타벅스 성산일출봉점|3|한때 한국 최고 매출점이었다는 말이 있었는데..  확인은 못했구요. 일출봉주변에 잠시 쉬어 갈만한 장소 라고 생각합니다.
커피전문점|스타벅스 성산일출봉점|5|음..여기 좋은데..바람 많이 불어서 못 올라 감..
커피전문점|스타벅스 성산일출봉점|3|그냥 스타벅스다 주차장이 좁다
커피전문점|스타벅스 성산일출봉점|5|성산일출봉을 바라보며 제주에서만 맛볼 수 있는 스타벅스 음료를 마실 수 있다는 것만으로도 기분 좋은 곳.
커피전문점|스타벅스 성산일출봉점|5|2층에서 드시면 전망이 좋습니다.
커피전문점|스타벅스 성산일출봉점|4|1,2층 모두 유리창이 깨끗하지 않아서 뷰는 그닥이네요
커피전문점|스타벅스 성산일출봉점|4|성산일출봉 앞의 스타벅스인점이 별4개임.
커피전문점|스타벅스 성산일출봉점|4|어차피 성산일출봉 안올라갈꺼니까 뷰맛집^^ㅋ 중국인들 당당하게 텤아웃으로 받고 실내에서 먹다가 5초만에 쫓겨남ㅋㅋㅋㅋㅋㅋㅋ
커피전문점|스타벅스 성산일출봉점|3|메뉴가 적어서 아쉬웠어요 그나마 먹으려했던것도 품절 ㅠ
커피전문점|스타벅스 성산일출봉점|5|늦게가면 제주도에서만 파는 디저트류는 다팔려서 못먹는듯. 성산일출봉보면서 먹는 디저트 굿
커피전문점|스타벅스 성산일출봉점|3|스타벅스 성산일출봉점  성산일출봉 주차장 앞에 있어요.…
커피전문점|스타벅스 성산일출봉점|5|오래된 스벅이지만 더운 여름을 이겨내게 해줄 음료~^^
커피전문점|스타벅스 성산일출봉점|3|알바가 자꾸 횡설수설하던데 주문도 이상하게되서 다른 커피가 나왔다. 근데 힘든차에 단게 와서 나쁘진 않았음 케잌은 맛있었음
커피전문점|스타벅스 성산일출봉점|4|성산일출봉 앞에 위치하나 건물로 인해 완전히 보이진 않습니다. 그러나 위치적으로 좋고 깨끗하고 좋습니다. 제주에서만 먹을 수 있는 당근케이크가 있습니다.
커피전문점|스타벅스 성산일출봉점|2|목말라서 들렸는데 일층은 그냥 스벅이고 이층이 혹시 뷰가좋을까 올라가봤더니 창문이 얼룩청소 하나도 안되있어서 그냥 밖이 안보임.. 걍 목마르면 가세요
커피전문점|스타벅스 성산일출봉점|4|성산일출봉 매표소 들어가기 전 입구쪽에 있어요. 주차장에 차 세우고 둘러보면 보여요~  매장 주차장도 따로 있어요.
커피전문점|스타벅스 성산일출봉점|3|여행중 잠깐쉬기좋아요 풍경도 좋고 근데 창이 너무 더러워서 좀 그랬어요 건물자체도 오래된건물이라 깔끔한 느낌은 못느꼈어요 ㅎㅎ 뷰는 정말좋아요~
커피전문점|스타벅스 성산일출봉점|4|시원한바람과 바다향이 느껴지는 성산일출봉입니다.
커피전문점|스타벅스 성산일출봉점|4|경치좋아요 맛이야 뭐~당연하구요
커피전문점|스타벅스 성산일출봉점|5|항상 사람 많지만 친절한곳
커피전문점|스타벅스 성산일출봉점|4|성산일출봉 페쇄. 스벅에서 제주에서만 맛 볼 수있는 음료를..
커피전문점|스타벅스 성산일출봉점|4|커피는 그냥 먹는데 빵종류는 아주 맛없습니다
커피전문점|스타벅스 성산일출봉점|5|성산일출봉을 바로 볼수있어서 좋아요
커피전문점|스타벅스 성산일출봉점|3|성산일출봉 주차장 바로앞이라 접근성은 너무좋아요.이근처 많은 까페가 성산일출봉이나 시원한 바다뷰가 최고장점인데 그런점에서 주차장뷰는 아쉬워요.
커피전문점|스타벅스 성산일출봉점|4|비 오는 성산일출봉을 창가에 앉아 보니 좋더라ㅡ 좀 더 확 트이면 좋겠지만 그래도 좋았다 ^^
커피전문점|스타벅스 성산일출봉점|5|여긴 전망좋네요
커피전문점|스타벅스 성산일출봉점|1|커피 기다리는데 딱30분 기다렸네요.15분 걸린다고 해서 주문했는데. 30분걸렸으면 주문안했지요.  혼자수고하는 직원만 고생이네요
커피전문점|스타벅스 성산일출봉점|4|스타벅스!!! 바로앞 성산일출봉!!! 뷰가~~ 크으으으으
커피전문점|스타벅스 성산일출봉점|5|커피를 마시며 성산일출봉을 감상해 보아요
커피전문점|스타벅스 성산일출봉점|3|저녁시간 갔는데 사람없고 직원분들 친절하심
커피전문점|스타벅스 성산일출봉점|3|시설이 별로에요.
커피전문점|스타벅스 성산일출봉점|3|그냥 스벅 온니 제주 음료랑 디저트 먹었는데 별로였음.
커피전문점|스타벅스 성산일출봉점|5|좋은 커피, 멋진 풍경~
커피전문점|스타벅스 성산일출봉점|4|생각보다 자리가 너무 좁았습니다.  커피 한잔 마시면서 일출봉 보려고 했는데 맑은날은 햇살이 너무 눈부시네요
커피전문점|스타벅스 성산일출봉점|5|제주에서 정말 좋아하는곳 중 한곳. 마음먹고 올라갔다오기에도 좋고 경치도 아름답다
커피전문점|스타벅스 성산일출봉점|1|서비스아주더러운곳?
커피전문점|스타벅스 성산일출봉점|5|별다방 성산일출봉
커피전문점|스타벅스 성산일출봉점|5|성산일출봉이 보여서 핫플레이스인데 그만큼 사람들이 엄청 많고 시끄러운 아쉬움이 있어요 하지만 제주 스타벅스에서만 판매하는 굿즈 구입을 위해선 꼭 방문해야하죠 ㅎ
커피전문점|스타벅스 성산일출봉점|5|성산에 오면 꼭 한번은 들렀다 가는 곳♡
커피전문점|스타벅스 성산일출봉점|4|스타벅스는 어딜가나 기본이상~~ 여긴 2층 뷰가 성산일출봉이 다 보임ㅋ
커피전문점|스타벅스 성산일출봉점|4|사람이  넘많아  커피맛이  아쉽습니다 ㅠㅠ
커피전문점|스타벅스 성산일출봉점|5|성산에서만 파는 스페셜음료는 꼭 먹어보세요
커피전문점|스타벅스 성산일출봉점|4|성산일출봉 힘들게 올라갔다가 내려와서 마시는 아이스아메리카노 좋았습니다. 제주 dm들도 많이 있네요..
커피전문점|스타벅스 성산일출봉점|4|제주도에서만 맛볼수 있는 음료와 케잌이 있어요 할인도 안되고  가격이 꽤있는데 제주가면 꼭 먹습니다…
커피전문점|스타벅스 성산일출봉점|4|대기는길었지만 쑥떡?스무디?? 인가... 맛있었어요 .
커피전문점|스타벅스 성산일출봉점|5|제주 아침 스벅커피는 진리
커피전문점|스타벅스 성산일출봉점|4|조금 뷰가 아쉽다. 내부 청결상태도 살짝 아쉽다.
커피전문점|스타벅스 성산일출봉점|4|코로나 땜시 사람이 없어서 좋았음 현무암러스크 맛있다 해서 두번이나 사먹음 제주도 초콜릿은 용량대비 가격이 사악함 케이스 값인듯
커피전문점|스타벅스 성산일출봉점|1|좁고.. 자리도 부족하고 청결하지도 못합니다
커피전문점|스타벅스 성산일출봉점|4|제주도 당근케익 맛나네요
커피전문점|스타벅스 성산일출봉점|1|남자직원 완전 불친절..품절메뉴 너무 많고..사람 많아서 바쁜건 알겠는데..손님대하는 직원태도가 완전 빵점이네요
커피전문점|스타벅스 성산일출봉점|5|이층에 앉았는데 창이 넘 더러워 뷰가 좀 아쉬웠어요~직원들이 친절하시네요
커피전문점|스타벅스 성산일출봉점|5|성산일출봉이 잘 보이는 곳이라서 성산일출봉 갔다가 차한잔의 여유를 부리기 좋아요! 2층에 뷰가 좋고 통유리라 좋습니다 직원분들도 친절해요!
커피전문점|스타벅스 성산일출봉점|4|성산일출봉 보이긴하는데 . 창좀닦아주면좋겠다
커피전문점|스타벅스 성산일출봉점|5|사람이 엄청 많아요!!
커피전문점|스타벅스 성산일출봉점|4|괜찮았어요
커피전문점|스타벅스 성산일출봉점|5|새코롬 돌코롬 한라봉 케이크 맛나요
커피전문점|스타벅스 성산일출봉점|5|커피야 여느 스타벅스가 비슷비슷하지만 여기에는 제주점에만 살수있는 스타벅스 컵이 있어요.
커피전문점|스타벅스 성산일출봉점|4|소소한데 별하나 추가는 성산일출봉이 보인다는점 ㅋ
커피전문점|스타벅스 성산일출봉점|4|일부 제주와 관련된 흥미로운 메뉴가 있어요.
커피전문점|스타벅스 성산일출봉점|3|Siren Order가 안되서 다소 불편해요~!
커피전문점|스타벅스 성산일출봉점|4|일출봉 주차장 옆으로 나오면 보이는 스벅점,
커피전문점|스타벅스 성산일출봉점|3|다좋은데 쑥떡 프라푸치노에 휘핑얹혀달라했는데.. 빼주셨어요..사람도 많지않았는데 ㅜㅜ
커피전문점|스타벅스 성산일출봉점|4|주차가 협소해서 커피를 마시다가 차를 빼주러 가야해서 불편했고, 성산일출봉을 보며 커피를 마시고 싶었는데 창문이 너무 더러워서 즐길수가 없었음 직원들 친절함
커피전문점|스타벅스 서귀포DT|5|직원들 너무 친절해요. 제가 가본 스타벅스 중 제일 친절한듯요. 물론 커피도 맛나요~^^
커피전문점|스타벅스 서귀포DT|5|DT로 많이 이용하다가 오늘 처음으로 도보로 매장에서 차를 마시고 왔어요. 2층까지 있고 꽤 넓어서 이용하기 편리합니다.
커피전문점|스타벅스 서귀포DT|5|드라이브스루 너무 잘 되어있어요. 대기줄이긴것같지만 오래기다리지 않아서 좋고 친절해서 좋고 모닝커피를 마시며 하루의 시작이 설레임으로 시작할수있다는게 좋네요.…
커피전문점|스타벅스 서귀포DT|5|쾌적한 공간에서 커피를 마시며 얘기를 나누거나, 디지털 기기로 업무를 편하게 볼 수 있어 좋다.
커피전문점|스타벅스 서귀포DT|4|매장이 넓고 조용했어요 주차공간이 15~20정도 가능한듯 했구요... 좀 기다려야했어요...
커피전문점|스타벅스 서귀포DT|5|넓고 좋음.  직원들 매우 친절함. 2차접종완료 여부를 철저히 확인함. 매우 감사합니다.
커피전문점|스타벅스 서귀포DT|4|사이렌오더로 제주에서만 먹을수있는 천혜향블랙티, 비자림콜드브루 시켰는데 맛있네요. 폭염에 지쳤는데 에어컨빵빵하고 자리간격 넓어서 좋아요.
커피전문점|스타벅스 서귀포DT|5|조용하고 청결하고 사고픈 거…
커피전문점|스타벅스 서귀포DT|4|이거 진짜맛없음.... 노트북들고가서 일하기 좋은장소
